---------------------------------------------------------------------
-------------------------DATA ABORT----------------------------------
---------------------------------------------------------------------
Data Abort when accessing address 0x8000002c
---------------------------------------------------------------------

---------------------------------------------------------------------
-------------------------BREAKPOINT----------------------------------
---------------------------------------------------------------------
Registers
R0: 0xc
R1: 0x1
R2: 0x2
R3: 0x3
R4: 0x0
R5: 0x0
R6: 0x0
R7: 0x0
SP: 0x81fffffc
LR: 0x80000017
PC: 0x8000001e
---------------------------------------------------------------------
STATUS
CPSR: nZCvqjifT_SVC
---------------------------------------------------------------------
Program Memory Short
0x80000000: 0x22022101
0x80000004: 0x48092303
0x80000008: 0x42841C04
0x8000000c: 0xDB0BD10C
0x80000010: 0xF000DC0A
0x80000014: 0xE7FEF801
0x80000018: 0xB500C00E
0x8000001c: 0x43C1BE00
0x80000020: 0x405B18D2
0x80000024: 0xBD00CCE0
0x80000028: 0xE7E9BE00
0x8000002c: 0x00009000
0x80000030: 0x00000000
0x80000034: 0x00000000
0x80000038: 0x00000000
0x8000003c: 0x00000000
0x80000040: 0x00000000
0x80000044: 0x00000000
0x80000048: 0x00000000
0x8000004c: 0x00000000
0x80000050: 0x00000000
0x80000054: 0x00000000
0x80000058: 0x00000000
0x8000005c: 0x00000000
0x80000060: 0x00000000
0x80000064: 0x00000000
0x80000068: 0x00000000
0x8000006c: 0x00000000
0x80000070: 0x00000000
0x80000074: 0x00000000
0x80000078: 0x00000000
0x8000007c: 0x00000000
0x80000080: 0x00000000
0x80000084: 0x00000000
0x80000088: 0x00000000
0x8000008c: 0x00000000
0x80000090: 0x00000000
0x80000094: 0x00000000
0x80000098: 0x00000000
0x8000009c: 0x00000000
0x800000a0: 0x00000000
0x800000a4: 0x00000000
0x800000a8: 0x00000000
0x800000ac: 0x00000000
0x800000b0: 0x00000000
0x800000b4: 0x00000000
0x800000b8: 0x00000000
0x800000bc: 0x00000000
0x800000c0: 0x00000000
0x800000c4: 0x00000000
0x800000c8: 0x00000000
0x800000cc: 0x00000000
0x800000d0: 0x00000000
0x800000d4: 0x00000000
0x800000d8: 0x00000000
0x800000dc: 0x00000000
0x800000e0: 0x00000000
0x800000e4: 0x00000000
0x800000e8: 0x00000000
0x800000ec: 0x00000000
0x800000f0: 0x00000000
0x800000f4: 0x00000000
0x800000f8: 0x00000000
0x800000fc: 0x00000000
---------------------------------------------------------------------
Data Memory Short
0x0: 0x00000001
0x4: 0x00000002
0x8: 0x00000003
---------------------------------------------------------------------
Stack Memory Short
0x81fffffc: 0x80000017
---------------------------------------------------------------------

---------------------------------------------------------------------
---------------------------------------------------------------------
------------------------SHOW STATUS----------------------------------
---------------------------------------------------------------------
Registers
R0: 0xc
R1: 0xfffffff3
R2: 0x5
R3: 0x0
R4: 0xc
R5: 0x1
R6: 0x2
R7: 0x3
SP: 0x82000000
LR: 0x80000017
PC: 0x80000018
---------------------------------------------------------------------
STATUS
CPSR: nZcvqjifT_SVC
---------------------------------------------------------------------
Program Memory Short
0x80000000: 0x22022101
0x80000004: 0x48092303
0x80000008: 0x42841C04
0x8000000c: 0xDB0BD10C
0x80000010: 0xF000DC0A
0x80000014: 0xE7FEF801
0x80000018: 0xB500C00E
0x8000001c: 0x43C1BE00
0x80000020: 0x405B18D2
0x80000024: 0xBD00CCE0
0x80000028: 0xE7E9BE00
0x8000002c: 0x00009000
0x80000030: 0x00000000
0x80000034: 0x00000000
0x80000038: 0x00000000
0x8000003c: 0x00000000
0x80000040: 0x00000000
0x80000044: 0x00000000
0x80000048: 0x00000000
0x8000004c: 0x00000000
0x80000050: 0x00000000
0x80000054: 0x00000000
0x80000058: 0x00000000
0x8000005c: 0x00000000
0x80000060: 0x00000000
0x80000064: 0x00000000
0x80000068: 0x00000000
0x8000006c: 0x00000000
0x80000070: 0x00000000
0x80000074: 0x00000000
0x80000078: 0x00000000
0x8000007c: 0x00000000
0x80000080: 0x00000000
0x80000084: 0x00000000
0x80000088: 0x00000000
0x8000008c: 0x00000000
0x80000090: 0x00000000
0x80000094: 0x00000000
0x80000098: 0x00000000
0x8000009c: 0x00000000
0x800000a0: 0x00000000
0x800000a4: 0x00000000
0x800000a8: 0x00000000
0x800000ac: 0x00000000
0x800000b0: 0x00000000
0x800000b4: 0x00000000
0x800000b8: 0x00000000
0x800000bc: 0x00000000
0x800000c0: 0x00000000
0x800000c4: 0x00000000
0x800000c8: 0x00000000
0x800000cc: 0x00000000
0x800000d0: 0x00000000
0x800000d4: 0x00000000
0x800000d8: 0x00000000
0x800000dc: 0x00000000
0x800000e0: 0x00000000
0x800000e4: 0x00000000
0x800000e8: 0x00000000
0x800000ec: 0x00000000
0x800000f0: 0x00000000
0x800000f4: 0x00000000
0x800000f8: 0x00000000
0x800000fc: 0x00000000
---------------------------------------------------------------------
Data Memory Short
0x0: 0x00000001
0x4: 0x00000002
0x8: 0x00000003
0x81fffffc: 0x80000017
---------------------------------------------------------------------
Stack Memory Short
---------------------------------------------------------------------

