---------------------------------------------------------------------
-------------------------BREAKPOINT----------------------------------
---------------------------------------------------------------------
Registers
R0: 0x1
R1: 0x5
R2: 0x0
R3: 0x0
R4: 0x0
R5: 0xffffffff
R6: 0x0
R7: 0x0
SP: 0x82000000
LR: 0x80000000
PC: 0x8000000a
---------------------------------------------------------------------
STATUS
CPSR: NzcvqjifT_SVC
---------------------------------------------------------------------
Program Memory Short
0x80000000: 0x21052001
0x80000004: 0x43E52400
0x80000008: 0x1A2DBE00
0x8000000c: 0x4E07DF13
0x80000010: 0x180A6877
0x80000014: 0xB406408A
0x80000018: 0xBE00B40C
0x8000001c: 0xBC04BC0A
0x80000020: 0x2A003A01
0x80000024: 0x1C10D000
0x80000028: 0x0000E7FE
0x8000002c: 0x00000000
0x80000030: 0x00000000
0x80000034: 0x00000000
0x80000038: 0x00000000
0x8000003c: 0x00000000
0x80000040: 0x00000000
0x80000044: 0x00000000
0x80000048: 0x00000000
0x8000004c: 0x00000000
0x80000050: 0x00000000
0x80000054: 0x00000000
0x80000058: 0x00000000
0x8000005c: 0x00000000
0x80000060: 0x00000000
0x80000064: 0x00000000
0x80000068: 0x00000000
0x8000006c: 0x00000000
0x80000070: 0x00000000
0x80000074: 0x00000000
0x80000078: 0x00000000
0x8000007c: 0x00000000
0x80000080: 0x00000000
0x80000084: 0x00000000
0x80000088: 0x00000000
0x8000008c: 0x00000000
0x80000090: 0x00000000
0x80000094: 0x00000000
0x80000098: 0x00000000
0x8000009c: 0x00000000
0x800000a0: 0x00000000
0x800000a4: 0x00000000
0x800000a8: 0x00000000
0x800000ac: 0x00000000
0x800000b0: 0x00000000
0x800000b4: 0x00000000
0x800000b8: 0x00000000
0x800000bc: 0x00000000
0x800000c0: 0x00000000
0x800000c4: 0x00000000
0x800000c8: 0x00000000
0x800000cc: 0x00000000
0x800000d0: 0x00000000
0x800000d4: 0x00000000
0x800000d8: 0x00000000
0x800000dc: 0x00000000
0x800000e0: 0x00000000
0x800000e4: 0x00000000
0x800000e8: 0x00000000
0x800000ec: 0x00000000
0x800000f0: 0x00000000
0x800000f4: 0x00000000
0x800000f8: 0x00000000
0x800000fc: 0x00000000
---------------------------------------------------------------------
Data Memory Short
---------------------------------------------------------------------
Stack Memory Short
---------------------------------------------------------------------

---------------------------------------------------------------------
---------------------------------------------------------------------
--------------------------------SWI----------------------------------
---------------------------------------------------------------------
SWI interrupt number is 0x13
---------------------------------------------------------------------

---------------------------------------------------------------------
-------------------------DATA ABORT----------------------------------
---------------------------------------------------------------------
Data Abort when accessing address 0x8000002c
---------------------------------------------------------------------

---------------------------------------------------------------------
-------------------------BREAKPOINT----------------------------------
---------------------------------------------------------------------
Registers
R0: 0x1
R1: 0x5
R2: 0xc0
R3: 0x0
R4: 0x0
R5: 0xfffffffe
R6: 0x0
R7: 0x0
SP: 0x81fffff0
LR: 0x80000000
PC: 0x8000001c
---------------------------------------------------------------------
STATUS
CPSR: nzcvqjifT_SVC
---------------------------------------------------------------------
Program Memory Short
0x80000000: 0x21052001
0x80000004: 0x43E52400
0x80000008: 0x1A2DBE00
0x8000000c: 0x4E07DF13
0x80000010: 0x180A6877
0x80000014: 0xB406408A
0x80000018: 0xBE00B40C
0x8000001c: 0xBC04BC0A
0x80000020: 0x2A003A01
0x80000024: 0x1C10D000
0x80000028: 0x0000E7FE
0x8000002c: 0x00000000
0x80000030: 0x00000000
0x80000034: 0x00000000
0x80000038: 0x00000000
0x8000003c: 0x00000000
0x80000040: 0x00000000
0x80000044: 0x00000000
0x80000048: 0x00000000
0x8000004c: 0x00000000
0x80000050: 0x00000000
0x80000054: 0x00000000
0x80000058: 0x00000000
0x8000005c: 0x00000000
0x80000060: 0x00000000
0x80000064: 0x00000000
0x80000068: 0x00000000
0x8000006c: 0x00000000
0x80000070: 0x00000000
0x80000074: 0x00000000
0x80000078: 0x00000000
0x8000007c: 0x00000000
0x80000080: 0x00000000
0x80000084: 0x00000000
0x80000088: 0x00000000
0x8000008c: 0x00000000
0x80000090: 0x00000000
0x80000094: 0x00000000
0x80000098: 0x00000000
0x8000009c: 0x00000000
0x800000a0: 0x00000000
0x800000a4: 0x00000000
0x800000a8: 0x00000000
0x800000ac: 0x00000000
0x800000b0: 0x00000000
0x800000b4: 0x00000000
0x800000b8: 0x00000000
0x800000bc: 0x00000000
0x800000c0: 0x00000000
0x800000c4: 0x00000000
0x800000c8: 0x00000000
0x800000cc: 0x00000000
0x800000d0: 0x00000000
0x800000d4: 0x00000000
0x800000d8: 0x00000000
0x800000dc: 0x00000000
0x800000e0: 0x00000000
0x800000e4: 0x00000000
0x800000e8: 0x00000000
0x800000ec: 0x00000000
0x800000f0: 0x00000000
0x800000f4: 0x00000000
0x800000f8: 0x00000000
0x800000fc: 0x00000000
---------------------------------------------------------------------
Data Memory Short
0x4: 0x00000000
---------------------------------------------------------------------
Stack Memory Short
0x81fffff0: 0x000000C0
0x81fffff4: 0x00000000
0x81fffff8: 0x00000005
0x81fffffc: 0x000000C0
---------------------------------------------------------------------

---------------------------------------------------------------------
---------------------------------------------------------------------
------------------------SHOW STATUS----------------------------------
---------------------------------------------------------------------
Registers
R0: 0x4
R1: 0xc0
R2: 0x4
R3: 0x0
R4: 0x0
R5: 0xfffffffe
R6: 0x0
R7: 0x0
SP: 0x81fffffc
LR: 0x80000000
PC: 0x8000002a
---------------------------------------------------------------------
STATUS
CPSR: nzcvqjifT_SVC
---------------------------------------------------------------------
Program Memory Short
0x80000000: 0x21052001
0x80000004: 0x43E52400
0x80000008: 0x1A2DBE00
0x8000000c: 0x4E07DF13
0x80000010: 0x180A6877
0x80000014: 0xB406408A
0x80000018: 0xBE00B40C
0x8000001c: 0xBC04BC0A
0x80000020: 0x2A003A01
0x80000024: 0x1C10D000
0x80000028: 0x0000E7FE
0x8000002c: 0x00000000
0x80000030: 0x00000000
0x80000034: 0x00000000
0x80000038: 0x00000000
0x8000003c: 0x00000000
0x80000040: 0x00000000
0x80000044: 0x00000000
0x80000048: 0x00000000
0x8000004c: 0x00000000
0x80000050: 0x00000000
0x80000054: 0x00000000
0x80000058: 0x00000000
0x8000005c: 0x00000000
0x80000060: 0x00000000
0x80000064: 0x00000000
0x80000068: 0x00000000
0x8000006c: 0x00000000
0x80000070: 0x00000000
0x80000074: 0x00000000
0x80000078: 0x00000000
0x8000007c: 0x00000000
0x80000080: 0x00000000
0x80000084: 0x00000000
0x80000088: 0x00000000
0x8000008c: 0x00000000
0x80000090: 0x00000000
0x80000094: 0x00000000
0x80000098: 0x00000000
0x8000009c: 0x00000000
0x800000a0: 0x00000000
0x800000a4: 0x00000000
0x800000a8: 0x00000000
0x800000ac: 0x00000000
0x800000b0: 0x00000000
0x800000b4: 0x00000000
0x800000b8: 0x00000000
0x800000bc: 0x00000000
0x800000c0: 0x00000000
0x800000c4: 0x00000000
0x800000c8: 0x00000000
0x800000cc: 0x00000000
0x800000d0: 0x00000000
0x800000d4: 0x00000000
0x800000d8: 0x00000000
0x800000dc: 0x00000000
0x800000e0: 0x00000000
0x800000e4: 0x00000000
0x800000e8: 0x00000000
0x800000ec: 0x00000000
0x800000f0: 0x00000000
0x800000f4: 0x00000000
0x800000f8: 0x00000000
0x800000fc: 0x00000000
---------------------------------------------------------------------
Data Memory Short
0x4: 0x00000000
0x81fffff0: 0x000000C0
0x81fffff4: 0x00000000
0x81fffff8: 0x00000005
---------------------------------------------------------------------
Stack Memory Short
0x81fffffc: 0x000000C0
---------------------------------------------------------------------

